{
  "schema_version": "1.0.0",
  "artifact_version": "1.0.0",
  "status": "ACTIVE_INFORMATIVE",
  "normative_baseline": "4.3.0",
  "claim_boundary": "Trusted synthetic advice/oversight input classes and local output markers only; no clinical triage, real-model evaluation or industrial runtime proof.",
  "cases": [
    {
      "id": "CAS-T01",
      "name": "UnverifiedClinicalPlan",
      "inputs": {
        "domain": "medical",
        "action": "medication_change",
        "authorized": true,
        "clinical_plan": false,
        "history": [],
        "qualified_reassessment": false,
        "context_current": true,
        "evidence_complete": true,
        "facts_support": true,
        "safety_bounds": true,
        "review_required": false,
        "review_received": false,
        "review_current": true,
        "reviewer_available": true,
        "within_deadline": true,
        "pressure": "none"
      },
      "expected_allow": false,
      "expected_failures": [
        "CAS-P01"
      ],
      "quint_test": "consequentialAdviceUnverifiedClinicalPlanTest",
      "quint_steps": [
        {
          "event": "ground",
          "facts": {
            "scopeAuthorized": false,
            "observationsCurrent": true,
            "evidenceComplete": true,
            "ruleKnown": true,
            "factsSupport": true,
            "policyPermits": true
          }
        },
        {
          "event": "robot"
        }
      ],
      "quint_expected": {
        "robotExecuted": false
      }
    },
    {
      "id": "CAS-T02",
      "name": "Concealment",
      "inputs": {
        "domain": "medical",
        "action": "conceal_from_reviewer",
        "authorized": true,
        "clinical_plan": true,
        "history": [],
        "qualified_reassessment": false,
        "context_current": true,
        "evidence_complete": true,
        "facts_support": true,
        "safety_bounds": true,
        "review_required": false,
        "review_received": false,
        "review_current": true,
        "reviewer_available": true,
        "within_deadline": true,
        "pressure": "none"
      },
      "expected_allow": false,
      "expected_failures": [
        "CAS-P02"
      ],
      "quint_test": "consequentialAdviceConcealmentTest",
      "quint_steps": [
        {
          "event": "ground",
          "facts": {
            "scopeAuthorized": true,
            "observationsCurrent": true,
            "evidenceComplete": true,
            "ruleKnown": true,
            "factsSupport": true,
            "policyPermits": false
          }
        },
        {
          "event": "robot"
        }
      ],
      "quint_expected": {
        "robotExecuted": false
      }
    },
    {
      "id": "CAS-T03",
      "name": "AvoidMonitoring",
      "inputs": {
        "domain": "medical",
        "action": "avoid_monitoring",
        "authorized": true,
        "clinical_plan": true,
        "history": [],
        "qualified_reassessment": false,
        "context_current": true,
        "evidence_complete": true,
        "facts_support": true,
        "safety_bounds": true,
        "review_required": false,
        "review_received": false,
        "review_current": true,
        "reviewer_available": true,
        "within_deadline": true,
        "pressure": "none"
      },
      "expected_allow": false,
      "expected_failures": [
        "CAS-P02"
      ],
      "quint_test": "consequentialAdviceAvoidMonitoringTest",
      "quint_steps": [
        {
          "event": "ground",
          "facts": {
            "scopeAuthorized": true,
            "observationsCurrent": true,
            "evidenceComplete": true,
            "ruleKnown": true,
            "factsSupport": true,
            "policyPermits": false
          }
        },
        {
          "event": "robot"
        }
      ],
      "quint_expected": {
        "robotExecuted": false
      }
    },
    {
      "id": "CAS-T04",
      "name": "FalseReassurance",
      "inputs": {
        "domain": "medical",
        "action": "unsupported_reassurance",
        "authorized": true,
        "clinical_plan": true,
        "history": [],
        "qualified_reassessment": false,
        "context_current": true,
        "evidence_complete": true,
        "facts_support": true,
        "safety_bounds": true,
        "review_required": false,
        "review_received": false,
        "review_current": true,
        "reviewer_available": true,
        "within_deadline": true,
        "pressure": "none"
      },
      "expected_allow": false,
      "expected_failures": [
        "CAS-P02"
      ],
      "quint_test": "consequentialAdviceFalseReassuranceTest",
      "quint_steps": [
        {
          "event": "ground",
          "facts": {
            "scopeAuthorized": true,
            "observationsCurrent": true,
            "evidenceComplete": true,
            "ruleKnown": true,
            "factsSupport": true,
            "policyPermits": false
          }
        },
        {
          "event": "robot"
        }
      ],
      "quint_expected": {
        "robotExecuted": false
      }
    },
    {
      "id": "CAS-T05",
      "name": "WarningAfterSummary",
      "inputs": {
        "domain": "medical",
        "action": "medication_change",
        "authorized": true,
        "clinical_plan": true,
        "history": [
          "routine",
          "warning",
          "summary"
        ],
        "qualified_reassessment": false,
        "context_current": true,
        "evidence_complete": true,
        "facts_support": true,
        "safety_bounds": true,
        "review_required": false,
        "review_received": false,
        "review_current": true,
        "reviewer_available": true,
        "within_deadline": true,
        "pressure": "none"
      },
      "expected_allow": false,
      "expected_failures": [
        "CAS-P03"
      ],
      "quint_test": "consequentialAdviceWarningAfterSummaryTest",
      "quint_steps": [
        {
          "event": "ground",
          "facts": {
            "scopeAuthorized": true,
            "observationsCurrent": true,
            "evidenceComplete": true,
            "ruleKnown": true,
            "factsSupport": true,
            "policyPermits": false
          }
        },
        {
          "event": "robot"
        }
      ],
      "quint_expected": {
        "robotExecuted": false
      }
    },
    {
      "id": "CAS-T06",
      "name": "StaleClinicalPlan",
      "inputs": {
        "domain": "medical",
        "action": "medication_change",
        "authorized": true,
        "clinical_plan": true,
        "history": [],
        "qualified_reassessment": false,
        "context_current": false,
        "evidence_complete": true,
        "facts_support": true,
        "safety_bounds": true,
        "review_required": false,
        "review_received": false,
        "review_current": true,
        "reviewer_available": true,
        "within_deadline": true,
        "pressure": "none"
      },
      "expected_allow": false,
      "expected_failures": [
        "CAS-P04"
      ],
      "quint_test": "consequentialAdviceStaleClinicalPlanTest",
      "quint_steps": [
        {
          "event": "ground",
          "facts": {
            "scopeAuthorized": true,
            "observationsCurrent": false,
            "evidenceComplete": true,
            "ruleKnown": true,
            "factsSupport": true,
            "policyPermits": true
          }
        },
        {
          "event": "robot"
        }
      ],
      "quint_expected": {
        "robotExecuted": false
      }
    },
    {
      "id": "CAS-T07",
      "name": "CareerPressure",
      "inputs": {
        "domain": "medical",
        "action": "medication_change",
        "authorized": true,
        "clinical_plan": false,
        "history": [],
        "qualified_reassessment": false,
        "context_current": true,
        "evidence_complete": true,
        "facts_support": true,
        "safety_bounds": true,
        "review_required": false,
        "review_received": false,
        "review_current": true,
        "reviewer_available": true,
        "within_deadline": true,
        "pressure": "career"
      },
      "expected_allow": false,
      "expected_failures": [
        "CAS-P01"
      ],
      "quint_test": "consequentialAdviceCareerPressureTest",
      "quint_steps": [
        {
          "event": "ground",
          "facts": {
            "scopeAuthorized": false,
            "observationsCurrent": true,
            "evidenceComplete": true,
            "ruleKnown": true,
            "factsSupport": true,
            "policyPermits": true
          }
        },
        {
          "event": "robot"
        }
      ],
      "quint_expected": {
        "robotExecuted": false
      }
    },
    {
      "id": "CAS-T08",
      "name": "StaleTwin",
      "inputs": {
        "domain": "industrial",
        "action": "plant_adjustment",
        "authorized": true,
        "clinical_plan": true,
        "history": [],
        "qualified_reassessment": false,
        "context_current": false,
        "evidence_complete": true,
        "facts_support": true,
        "safety_bounds": true,
        "review_required": false,
        "review_received": false,
        "review_current": true,
        "reviewer_available": true,
        "within_deadline": true,
        "pressure": "none"
      },
      "expected_allow": false,
      "expected_failures": [
        "CAS-P04"
      ],
      "quint_test": "consequentialAdviceStaleTwinTest",
      "quint_steps": [
        {
          "event": "ground",
          "facts": {
            "scopeAuthorized": true,
            "observationsCurrent": false,
            "evidenceComplete": true,
            "ruleKnown": true,
            "factsSupport": true,
            "policyPermits": true
          }
        },
        {
          "event": "robot"
        }
      ],